optimus-136@optimus-136:~$ mysql -u root -p
Enter password: 
ERROR 1045 (28000): Access denied for user 'root'@'localhost' (using password: YES)
optimus-136@optimus-136:~$ parasopt
parasopt: command not found
optimus-136@optimus-136:~$ mysql -u root -p
Enter password: 
Welcome to the MySQL monitor.  Commands end with ; or \g.
Your MySQL connection id is 37
Server version: 5.6.33-0ubuntu0.14.04.1 (Ubuntu)

Copyright (c) 2000, 2016, Oracle and/or its affiliates. All rights reserved.

Oracle is a registered trademark of Oracle Corporation and/or its
affiliates. Other names may be trademarks of their respective
owners.

Type 'help;' or '\h' for help. Type '\c' to clear the current input statement.

mysql> use data;
Reading table information for completion of table and column names
You can turn off this feature to get a quicker startup with -A

Database changed
mysql> create table customer(customer_id varchar(20),customer_name varcahr(20),order_date date);
ERROR 1064 (42000): You have an error in your SQL syntax; check the manual that corresponds to your MySQL server version for the right syntax to use near 'varcahr(20),order_date date)' at line 1
mysql> create table customer(customer_id varchar(20),customer_name varcahr(20),order_date DATE);
ERROR 1064 (42000): You have an error in your SQL syntax; check the manual that corresponds to your MySQL server version for the right syntax to use near 'varcahr(20),order_date DATE)' at line 1
mysql> create table customer(customer_id varchar(20),customer_name varcharr(20),order_date DATE);
ERROR 1064 (42000): You have an error in your SQL syntax; check the manual that corresponds to your MySQL server version for the right syntax to use near 'varcharr(20),order_date DATE)' at line 1
mysql> create table customer(customer_id varchar(20),customer_name varchar(20),order_date DATE);
Query OK, 0 rows affected (0.33 sec)

mysql> desc customer;
+---------------+-------------+------+-----+---------+-------+
| Field         | Type        | Null | Key | Default | Extra |
+---------------+-------------+------+-----+---------+-------+
| customer_id   | varchar(20) | YES  |     | NULL    |       |
| customer_name | varchar(20) | YES  |     | NULL    |       |
| order_date    | date        | YES  |     | NULL    |       |
+---------------+-------------+------+-----+---------+-------+
3 rows in set (0.00 sec)

mysql> insert into customer values(2,Rishabh,2017-06-07);
ERROR 1054 (42S22): Unknown column 'Rishabh' in 'field list'
mysql> insert into customer values(2,"Rishabh",2017-06-07);
Query OK, 1 row affected, 1 warning (0.03 sec)

mysql> insert into customer values(4,"Raj",2016-05-06);
Query OK, 1 row affected, 1 warning (0.04 sec)

mysql> insert into customer values(5,"Mohan",2015-04-03);
Query OK, 1 row affected, 1 warning (0.03 sec)

mysql> insert into customer values(7,"Sohan",2013-02-08);
Query OK, 1 row affected, 1 warning (0.03 sec)

mysql> select * from  customer;
+-------------+---------------+------------+
| customer_id | customer_name | order_date |
+-------------+---------------+------------+
| 2           | Rishabh       | 0000-00-00 |
| 4           | Raj           | 0000-00-00 |
| 5           | Mohan         | 0000-00-00 |
| 7           | Sohan         | 0000-00-00 |
+-------------+---------------+------------+
4 rows in set (0.00 sec)

mysql> select * from  emp;
+------------+-----------+--------+--------+---------------+------------+
| First_Name | Last_Name | Emp_Id | Salary | desig         | doj        |
+------------+-----------+--------+--------+---------------+------------+
| Paras      | Agarwal   |      1 | 400000 | Software_Engg | 2012-04-06 |
| Mohit      | Agarwal   |      2 | 200000 | Tester        | NULL       |
| Rohit      | Agarwal   |      3 | 300000 | Analyst       | NULL       |
+------------+-----------+--------+--------+---------------+------------+
3 rows in set (0.01 sec)

mysql> update customer set order_date="2017-06-07" where customer_id=2;
Query OK, 1 row affected (0.08 sec)
Rows matched: 1  Changed: 1  Warnings: 0

mysql> select * from  customer;
+-------------+---------------+------------+
| customer_id | customer_name | order_date |
+-------------+---------------+------------+
| 2           | Rishabh       | 2017-06-07 |
| 4           | Raj           | 0000-00-00 |
| 5           | Mohan         | 0000-00-00 |
| 7           | Sohan         | 0000-00-00 |
+-------------+---------------+------------+
4 rows in set (0.00 sec)

mysql> update customer set order_date="2016-05-06" where customer_id=4;
Query OK, 1 row affected (0.04 sec)
Rows matched: 1  Changed: 1  Warnings: 0

mysql> update customer set order_date="2015-04-04" where customer_id=5;
Query OK, 1 row affected (0.04 sec)
Rows matched: 1  Changed: 1  Warnings: 0

mysql> update customer set order_date="2013-02-03" where customer_id=7;
Query OK, 1 row affected (0.03 sec)
Rows matched: 1  Changed: 1  Warnings: 0

mysql> select * from  customer;
+-------------+---------------+------------+
| customer_id | customer_name | order_date |
+-------------+---------------+------------+
| 2           | Rishabh       | 2017-06-07 |
| 4           | Raj           | 2016-05-06 |
| 5           | Mohan         | 2015-04-04 |
| 7           | Sohan         | 2013-02-03 |
+-------------+---------------+------------+
4 rows in set (0.00 sec)

mysql> select * from  emp;
+------------+-----------+--------+--------+---------------+------------+
| First_Name | Last_Name | Emp_Id | Salary | desig         | doj        |
+------------+-----------+--------+--------+---------------+------------+
| Paras      | Agarwal   |      1 | 400000 | Software_Engg | 2012-04-06 |
| Mohit      | Agarwal   |      2 | 200000 | Tester        | NULL       |
| Rohit      | Agarwal   |      3 | 300000 | Analyst       | NULL       |
+------------+-----------+--------+--------+---------------+------------+
3 rows in set (0.00 sec)

mysql> alter table customer add last_name varchar(20);
Query OK, 0 rows affected (0.56 sec)
Records: 0  Duplicates: 0  Warnings: 0

mysql> select * from  customer;
+-------------+---------------+------------+-----------+
| customer_id | customer_name | order_date | last_name |
+-------------+---------------+------------+-----------+
| 2           | Rishabh       | 2017-06-07 | NULL      |
| 4           | Raj           | 2016-05-06 | NULL      |
| 5           | Mohan         | 2015-04-04 | NULL      |
| 7           | Sohan         | 2013-02-03 | NULL      |
+-------------+---------------+------------+-----------+
4 rows in set (0.00 sec)

mysql> update customer set last_name="singh"  where customer_id=2;
Query OK, 1 row affected (0.04 sec)
Rows matched: 1  Changed: 1  Warnings: 0

mysql> update customer set last_name="agarwal" where customer_id=4;
Query OK, 1 row affected (0.05 sec)
Rows matched: 1  Changed: 1  Warnings: 0

mysql> update customer set last_name="kapoor" where customer_id=5;
Query OK, 1 row affected (0.04 sec)
Rows matched: 1  Changed: 1  Warnings: 0

mysql> update customer set last_name="gupta" where customer_id=7;
Query OK, 1 row affected (0.04 sec)
Rows matched: 1  Changed: 1  Warnings: 0

mysql> select * from  customer;
+-------------+---------------+------------+-----------+
| customer_id | customer_name | order_date | last_name |
+-------------+---------------+------------+-----------+
| 2           | Rishabh       | 2017-06-07 | singh     |
| 4           | Raj           | 2016-05-06 | agarwal   |
| 5           | Mohan         | 2015-04-04 | kapoor    |
| 7           | Sohan         | 2013-02-03 | gupta     |
+-------------+---------------+------------+-----------+
4 rows in set (0.00 sec)

mysql> select * from  emp;
+------------+-----------+--------+--------+---------------+------------+
| First_Name | Last_Name | Emp_Id | Salary | desig         | doj        |
+------------+-----------+--------+--------+---------------+------------+
| Paras      | Agarwal   |      1 | 400000 | Software_Engg | 2012-04-06 |
| Mohit      | Agarwal   |      2 | 200000 | Tester        | NULL       |
| Rohit      | Agarwal   |      3 | 300000 | Analyst       | NULL       |
+------------+-----------+--------+--------+---------------+------------+
3 rows in set (0.00 sec)

mysql> select customer.customer_id,emp.Emp_Id,emp.Salary from customer inner join emp on customer.last_name=emp.last_name;
+-------------+--------+--------+
| customer_id | Emp_Id | Salary |
+-------------+--------+--------+
| 4           |      1 | 400000 |
| 4           |      2 | 200000 |
| 4           |      3 | 300000 |
+-------------+--------+--------+
3 rows in set (0.02 sec)

mysql> select customer.customer_id,emp.Emp_Id,emp.Salary from customer left join emp on customer.last_name=emp.last_name;
+-------------+--------+--------+
| customer_id | Emp_Id | Salary |
+-------------+--------+--------+
| 4           |      1 | 400000 |
| 4           |      2 | 200000 |
| 4           |      3 | 300000 |
| 2           |   NULL |   NULL |
| 5           |   NULL |   NULL |
| 7           |   NULL |   NULL |
+-------------+--------+--------+
6 rows in set (0.01 sec)

mysql> select customer.customer_id,emp.Emp_Id,emp.Salary from customer right join emp on customer.last_name=emp.last_name;
+-------------+--------+--------+
| customer_id | Emp_Id | Salary |
+-------------+--------+--------+
| 4           |      1 | 400000 |
| 4           |      2 | 200000 |
| 4           |      3 | 300000 |
+-------------+--------+--------+
3 rows in set (0.00 sec)

mysql> select customer.customer_id,emp.Emp_Id,emp.Salary from customer full join emp on customer.last_name=emp.last_name;
ERROR 1054 (42S22): Unknown column 'customer.customer_id' in 'field list'
mysql> select customer.customer_id,emp.Emp_Id,emp.Salary from customer right join emp on customer.last_name=emp.last_name;
+-------------+--------+--------+
| customer_id | Emp_Id | Salary |
+-------------+--------+--------+
| 4           |      1 | 400000 |
| 4           |      2 | 200000 |
| 4           |      3 | 300000 |
+-------------+--------+--------+
3 rows in set (0.00 sec)

mysql> select customer.customer_id,emp.Emp_Id,emp.Salary from customer full join emp on customer.last_name=emp.last_name;
ERROR 1054 (42S22): Unknown column 'customer.customer_id' in 'field list'
mysql> select customer.customer_id,emp.Emp_Id,emp.Salary from customer full join emp on customer.last_name=emp.last_name;
ERROR 1054 (42S22): Unknown column 'customer.customer_id' in 'field list'
mysql> select * from  customer;
+-------------+---------------+------------+-----------+
| customer_id | customer_name | order_date | last_name |
+-------------+---------------+------------+-----------+
| 2           | Rishabh       | 2017-06-07 | singh     |
| 4           | Raj           | 2016-05-06 | agarwal   |
| 5           | Mohan         | 2015-04-04 | kapoor    |
| 7           | Sohan         | 2013-02-03 | gupta     |
+-------------+---------------+------------+-----------+
4 rows in set (0.00 sec)

mysql> select * from  emp;
+------------+-----------+--------+--------+---------------+------------+
| First_Name | Last_Name | Emp_Id | Salary | desig         | doj        |
+------------+-----------+--------+--------+---------------+------------+
| Paras      | Agarwal   |      1 | 400000 | Software_Engg | 2012-04-06 |
| Mohit      | Agarwal   |      2 | 200000 | Tester        | NULL       |
| Rohit      | Agarwal   |      3 | 300000 | Analyst       | NULL       |
+------------+-----------+--------+--------+---------------+------------+
3 rows in set (0.00 sec)

mysql> select customer.customer_id,emp.Emp_Id,emp.Salary from customer full join emp on customer.last_name=emp.last_name;
ERROR 1054 (42S22): Unknown column 'customer.customer_id' in 'field list'
mysql> select customer.customer_id,emp.Emp_Id,emp.Salary from customer full join emp on customer.last_name=emp.last_name;
ERROR 1054 (42S22): Unknown column 'customer.customer_id' in 'field list'
mysql> select customer.customer_id,emp.Emp_Id,emp.Salary from customer right join emp on customer.last_name=emp.last_name;
+-------------+--------+--------+
| customer_id | Emp_Id | Salary |
+-------------+--------+--------+
| 4           |      1 | 400000 |
| 4           |      2 | 200000 |
| 4           |      3 | 300000 |
+-------------+--------+--------+
3 rows in set (0.00 sec)

mysql> select * from  customer;
+-------------+---------------+------------+-----------+
| customer_id | customer_name | order_date | last_name |
+-------------+---------------+------------+-----------+
| 2           | Rishabh       | 2017-06-07 | singh     |
| 4           | Raj           | 2016-05-06 | agarwal   |
| 5           | Mohan         | 2015-04-04 | kapoor    |
| 7           | Sohan         | 2013-02-03 | gupta     |
+-------------+---------------+------------+-----------+
4 rows in set (0.00 sec)

mysql> select * from  emp;
+------------+-----------+--------+--------+---------------+------------+
| First_Name | Last_Name | Emp_Id | Salary | desig         | doj        |
+------------+-----------+--------+--------+---------------+------------+
| Paras      | Agarwal   |      1 | 400000 | Software_Engg | 2012-04-06 |
| Mohit      | Agarwal   |      2 | 200000 | Tester        | NULL       |
| Rohit      | Agarwal   |      3 | 300000 | Analyst       | NULL       |
+------------+-----------+--------+--------+---------------+------------+
3 rows in set (0.00 sec)

mysql> select customer.customer_id,emp.Emp_Id,emp.Salary from customer left join emp on customer.last_name=emp.last_name;
+-------------+--------+--------+
| customer_id | Emp_Id | Salary |
+-------------+--------+--------+
| 4           |      1 | 400000 |
| 4           |      2 | 200000 |
| 4           |      3 | 300000 |
| 2           |   NULL |   NULL |
| 5           |   NULL |   NULL |
| 7           |   NULL |   NULL |
+-------------+--------+--------+
6 rows in set (0.00 sec)

mysql> select customer.customer_id,emp.Emp_Id,emp.Salary from customer right join emp on customer.last_name=emp.last_name;
+-------------+--------+--------+
| customer_id | Emp_Id | Salary |
+-------------+--------+--------+
| 4           |      1 | 400000 |
| 4           |      2 | 200000 |
| 4           |      3 | 300000 |
+-------------+--------+--------+
3 rows in set (0.00 sec)

mysql> select customer.customer_id,emp.Emp_Id,emp.Salary from customer full join emp on customer.last_name=emp.last_name;
ERROR 1054 (42S22): Unknown column 'customer.customer_id' in 'field list'
mysql> select * from customer full join emp on customer.last_name=emp.last_name;
ERROR 1054 (42S22): Unknown column 'customer.last_name' in 'on clause'
mysql> select * from customer full join emp on customer.last_name=emp.Last_name;
ERROR 1054 (42S22): Unknown column 'customer.last_name' in 'on clause'
mysql> select customer.customer_id,emp.Emp_Id,emp.Salary from customer full outer join emp on customer.last_name=emp.last_name;
ERROR 1064 (42000): You have an error in your SQL syntax; check the manual that corresponds to your MySQL server version for the right syntax to use near 'outer join emp on customer.last_name=emp.last_name' at line 1
mysql> select customer.customer_id,emp.Emp_Id,emp.Salary from customer left join emp on customer.last_name=emp.last_name;
+-------------+--------+--------+
| customer_id | Emp_Id | Salary |
+-------------+--------+--------+
| 4           |      1 | 400000 |
| 4           |      2 | 200000 |
| 4           |      3 | 300000 |
| 2           |   NULL |   NULL |
| 5           |   NULL |   NULL |
| 7           |   NULL |   NULL |
+-------------+--------+--------+
6 rows in set (0.00 sec)

mysql> select * from customer left join emp on customer.last_name=emp.last_name;
+-------------+---------------+------------+-----------+------------+-----------+--------+--------+---------------+------------+
| customer_id | customer_name | order_date | last_name | First_Name | Last_Name | Emp_Id | Salary | desig         | doj        |
+-------------+---------------+------------+-----------+------------+-----------+--------+--------+---------------+------------+
| 4           | Raj           | 2016-05-06 | agarwal   | Paras      | Agarwal   |      1 | 400000 | Software_Engg | 2012-04-06 |
| 4           | Raj           | 2016-05-06 | agarwal   | Mohit      | Agarwal   |      2 | 200000 | Tester        | NULL       |
| 4           | Raj           | 2016-05-06 | agarwal   | Rohit      | Agarwal   |      3 | 300000 | Analyst       | NULL       |
| 2           | Rishabh       | 2017-06-07 | singh     | NULL       | NULL      |   NULL |   NULL | NULL          | NULL       |
| 5           | Mohan         | 2015-04-04 | kapoor    | NULL       | NULL      |   NULL |   NULL | NULL          | NULL       |
| 7           | Sohan         | 2013-02-03 | gupta     | NULL       | NULL      |   NULL |   NULL | NULL          | NULL       |
+-------------+---------------+------------+-----------+------------+-----------+--------+--------+---------------+------------+
6 rows in set (0.00 sec)

mysql> select * from customer left join emp on customer.last_name = emp.last_name;
+-------------+---------------+------------+-----------+------------+-----------+--------+--------+---------------+------------+
| customer_id | customer_name | order_date | last_name | First_Name | Last_Name | Emp_Id | Salary | desig         | doj        |
+-------------+---------------+------------+-----------+------------+-----------+--------+--------+---------------+------------+
| 4           | Raj           | 2016-05-06 | agarwal   | Paras      | Agarwal   |      1 | 400000 | Software_Engg | 2012-04-06 |
| 4           | Raj           | 2016-05-06 | agarwal   | Mohit      | Agarwal   |      2 | 200000 | Tester        | NULL       |
| 4           | Raj           | 2016-05-06 | agarwal   | Rohit      | Agarwal   |      3 | 300000 | Analyst       | NULL       |
| 2           | Rishabh       | 2017-06-07 | singh     | NULL       | NULL      |   NULL |   NULL | NULL          | NULL       |
| 5           | Mohan         | 2015-04-04 | kapoor    | NULL       | NULL      |   NULL |   NULL | NULL          | NULL       |
| 7           | Sohan         | 2013-02-03 | gupta     | NULL       | NULL      |   NULL |   NULL | NULL          | NULL       |
+-------------+---------------+------------+-----------+------------+-----------+--------+--------+---------------+------------+
6 rows in set (0.00 sec)

mysql> select * from customer full join emp on customer.last_name = emp.last_name;
ERROR 1054 (42S22): Unknown column 'customer.last_name' in 'on clause'
mysql> select * from customer full outer join emp on customer.last_name = emp.last_name;
ERROR 1064 (42000): You have an error in your SQL syntax; check the manual that corresponds to your MySQL server version for the right syntax to use near 'outer join emp on customer.last_name = emp.last_name' at line 1
mysql> select * from emp full outer join customer on emp.last_name=customer.last_name
    -> ;
ERROR 1064 (42000): You have an error in your SQL syntax; check the manual that corresponds to your MySQL server version for the right syntax to use near 'outer join customer on emp.last_name=customer.last_name' at line 1
mysql> alter table emp add sys_no varchar(20);
Query OK, 0 rows affected (0.59 sec)
Records: 0  Duplicates: 0  Warnings: 0

mysql> alter table customer add sys_no varchar(20);
Query OK, 0 rows affected (0.47 sec)
Records: 0  Duplicates: 0  Warnings: 0

mysql> select * from emp;
+------------+-----------+--------+--------+---------------+------------+--------+
| First_Name | Last_Name | Emp_Id | Salary | desig         | doj        | sys_no |
+------------+-----------+--------+--------+---------------+------------+--------+
| Paras      | Agarwal   |      1 | 400000 | Software_Engg | 2012-04-06 | NULL   |
| Mohit      | Agarwal   |      2 | 200000 | Tester        | NULL       | NULL   |
| Rohit      | Agarwal   |      3 | 300000 | Analyst       | NULL       | NULL   |
+------------+-----------+--------+--------+---------------+------------+--------+
3 rows in set (0.00 sec)

mysql> select * from customer;
+-------------+---------------+------------+-----------+--------+
| customer_id | customer_name | order_date | last_name | sys_no |
+-------------+---------------+------------+-----------+--------+
| 2           | Rishabh       | 2017-06-07 | singh     | NULL   |
| 4           | Raj           | 2016-05-06 | agarwal   | NULL   |
| 5           | Mohan         | 2015-04-04 | kapoor    | NULL   |
| 7           | Sohan         | 2013-02-03 | gupta     | NULL   |
+-------------+---------------+------------+-----------+--------+
4 rows in set (0.00 sec)

mysql> select * from emp full outer join customer on emp.sys_no=customer.sys_no;
ERROR 1064 (42000): You have an error in your SQL syntax; check the manual that corresponds to your MySQL server version for the right syntax to use near 'outer join customer on emp.sys_no=customer.sys_no' at line 1
mysql> 

